{
  "contract_version": "gkos-retrieval-evaluation-ndcg-table/1.0.0-draft.1",
  "ndcg_discount_scale": 1000000000000,
  "rank_count": 100,
  "ndcg_discount_scaled": [
    1000000000000,
    630929753571,
    500000000000,
    430676558073,
    386852807235,
    356207187108,
    333333333333,
    315464876786,
    301029995664,
    289064826318,
    278942945651,
    270238154427,
    262649535037,
    255958024810,
    250000000000,
    244650542118,
    239812466568,
    235408913367,
    231378213160,
    227670248697,
    224243824218,
    221064729458,
    218104291986,
    215338279037,
    212746053553,
    210309917857,
    208014597677,
    205846832460,
    203795047091,
    201849086582,
    200000000000,
    198239863171,
    196561632233,
    194959021894,
    193426403617,
    191958720007,
    190551412427,
    189200359517,
    187901824709,
    186652411239,
    185449023415,
    184288833149,
    183169250914,
    182087900470,
    181042596780,
    180031326657,
    179052231751,
    178103593554,
    177183820136,
    176291434389,
    175425063582,
    174583430048,
    173765342871,
    172969690445,
    172195433794,
    171441600574,
    170707279664,
    169991616287,
    169293807599,
    168613098690,
    167948778957,
    167300178810,
    166666666667,
    166047646216,
    165442553919,
    164850856722,
    164272049962,
    163705655445,
    163151219684,
    162608312272,
    162076524393,
    161555467443,
    161044771756,
    160544085434,
    160053073255,
    159571415670,
    159098807869,
    158634958916,
    158179590940,
    157732438393,
    157293247350,
    156861774859,
    156437788342,
    156021065022,
    155611391402,
    155208562770,
    154812382736,
    154422662801,
    154039221954,
    153661886290,
    153290488653,
    152924868303,
    152564870601,
    152210346713,
    151861153331,
    151517152410,
    151178210922,
    150844200623,
    150514997832,
    150190483224
  ],
  "generator": {
    "arithmetic": "decimal",
    "precision": 80,
    "rounding": "ROUND_HALF_UP",
    "formula": "ndcg_discount_scale * ln(2) / ln(rank + 1)"
  },
  "table_digest": "sha256:4639dcbd6902da38cb5fa44918736f10d69714453bf57da05ecc5783ba0684a9"
}
